{
  "name": "Register for gambling tax",
  "description": "Register for General Betting Duty (GBD), Pool Betting Duty (PBD) or Remote Gaming Duty (RGD).",
  "theme": "Money and tax",
  "organisation": "HM Revenue and Customs",
  "phase": "Beta",
  "startPage": [
    "https://www.gov.uk/register-pay-gambling-tax",
    "https://www.gov.uk/file-gambling-tax-return"
  ],
  "liveService": "https://www.tax.service.gov.uk/gg/sign-in?continue=/business-account/&origin=GAMBLING-frontend",
  "synonyms": [
    "File your gambling tax return"
  ]
}
