{
  "name": "Check and challenge your Council Tax band",
  "synonyms": ["Check your Council Tax band"],
  "description": "Find out the Council Tax band for a home in England or Wales by looking up its address or postcode. You can also use this service to challenge your Council Tax band if you think itâ€™s wrong.",
  "organisation": "HM Revenue and Customs",
  "theme": "Money and tax",
  "phase": "Beta",
  "liveService": "https://www.tax.service.gov.uk/check-council-tax-band/search",
  "startPage": "https://www.gov.uk/council-tax-bands"
}
