{
  "name": "Check for flooding",
  "description": "Use this service to check current flood warnings or alerts, river, sea, groundwater and rainfall levels and flood risk in the next 5 days.",
  "theme": "Environment and countryside",
  "organisation": "Environment Agency",
  "phase": "Beta",
  "startPage": "https://www.gov.uk/check-flooding",
  "liveService": "https://check-for-flooding.service.gov.uk/",
  "sourceCode": [
    {
      "text": "Source code",
      "href": "https://github.com/DEFRA/flood-app"
    }
  ],
  "synonyms": ["Check for flooding "]
}
