{
  "name": "Skills for careers",
  "description": "You can get career ideas and browse your training options at your own pace. Try to consider whatâ€™s possible now or for the future.",
  "organisation": "Department for Education",
  "theme": "Education and learning",
  "phase": "Beta",
  "liveService": "https://www.skillsforcareers.education.gov.uk"
}
