{
  "name": "Get help arranging child maintenance",
  "synonyms": [
    "Apply for help arranging Child Maintenance"
  ],
  "description": "This service will give you information about the different options available to make a child maintenance arrangement.",
  "organisation": "Department for Work and Pensions",
  "theme": "Childcare and parenting",
  "phase": "Beta",
  "liveService": "https://child-maintenance.service.gov.uk/get-help-arranging-child-maintenance/",
  "startPage": "https://www.gov.uk/child-maintenance-service/how-to-apply",
  "timeline": {
    "items": [
      {
        "label": "Passed alpha assessment",
        "date": "2019-10-24",
        "links": [
          {
            "href": "https://www.gov.uk/service-standard-reports/apply-for-help-arranging-child-maintenance-alpha-assessment",
            "text": "Service assessment report",
            "visuallyHiddenText": " for alpha assessment"
          }
        ]
      },
      {
        "label": "Passed second alpha assessment",
        "date": "2021-06-10",
        "links": [
          {
            "href": "https://www.gov.uk/service-standard-reports/get-help-arranging-child-maintenance-alpha-assessment",
            "text": "Service assessment report",
            "visuallyHiddenText": " for second alpha assessment"
          }
        ]
      },
      {
        "label": "Passed beta assessment",
        "date": "2020-12-03",
        "links": [
          {
            "href": "https://www.gov.uk/service-standard-reports/apply-for-help-arranging-child-maintenance-beta-assessment",
            "text": "Service assessment report",
            "visuallyHiddenText": " for beta assessment"
          }
        ]
      },
      {
        "label": "Did not pass beta assessment",
        "date": "2022-07-20",
        "links": [
          {
            "href": "https://www.gov.uk/service-standard-reports/get-help-arranging-child-maintenance",
            "text": "Service assessment report",
            "visuallyHiddenText": "for beta assessment"
          }
        ]
      }
    ]
  }
}
