{
  "name": "Check International Trade Barriers",
  "description": "Find information about potential barriers to exporting goods, providing services or investing in foreign countries",
  "organisation": "Department for International Trade",
  "theme": "Business and self-employed",
  "phase": "Beta",
  "liveService": "https://check-international-trade-barriers.service.gov.uk/",
  "startPage": "https://www.gov.uk/barriers-trading-investing-abroad",
  "synonyms": ["Check for barriers to trading and investing abroad"]
}
