{
  "name": "Plastic packaging tax",
  "synonyms": ["Register for Plastic Packaging Tax"],
  "description": "Entities that import or produce plastic packaging will soon be liable for a tax. This service allows users to register, fill in returns and pay the tax due.",
  "organisation": "HM Revenue and Customs",
  "theme": "Business and self-employed",
  "phase": "Beta",
  "startPage": "https://www.gov.uk/guidance/register-for-plastic-packaging-tax",
  "liveService": "https://www.tax.service.gov.uk/register-for-plastic-packaging-tax/start-registration",
  "timeline": {
    "items": [
      {
        "label": "Passed alpha assessment",
        "date": "2021-09-24",
        "links": [
          {
            "href": "https://www.gov.uk/service-standard-reports/plastic-packaging-tax",
            "text": "Service assessment report",
            "visuallyHiddenText": " for alpha assessment"
          }
        ]
      },
      {
        "label": "Passed beta assessment",
        "date": "2022-03-08",
        "links": [
          {
            "href": "https://www.gov.uk/service-standard-reports/plastic-packaging-tax-beta-assessment",
            "text": "Service assessment report",
            "visuallyHiddenText": " for beta assessment"
          }
        ]
      }
    ]
  }
}
