{
  "name": "Find apprenticeship training for your apprentice",
  "synonyms": ["Find apprenticeship training if you're an employer"],
  "description": "If you’re an employer, you can find training for your apprentices.",
  "theme": "Education and learning",
  "organisation": ["Department for Education"],
  "phase": "Beta",
  "startPage": "https://www.gov.uk/employers-find-apprenticeship-training",
  "liveService": "https://findapprenticeshiptraining.apprenticeships.education.gov.uk/courses",
  "sourceCode": [
    {
      "text": "Source code",
      "href": "https://github.com/SkillsFundingAgency/das-findapprenticeshiptraining"
    }
  ]
}
