{
  "name": "Change your driving test",
  "description": "Use this service to find an earlier driving test, move your driving test to a later date or change which test centre you take your test at.",
  "theme": "Driving and transport",
  "organisation": "Driver and Vehicle Standards Agency",
  "phase": "Beta",
  "liveService": "https://driverpracticaltest.dvsa.gov.uk/login",
  "startPage": [
    "https://www.gov.uk/change-driving-test",
    "https://www.gov.uk/check-driving-test",
    "https://www.gov.uk/cancel-driving-test"
  ],
  "synonyms": [
    "Change your driving test appointment",
    "Check your driving test appointment details",
    "Cancel your driving test"
  ]
}
