{
  "name": "Licensing for International Trade",
  "description": "The new Licensing for International Trade and Enterprise service, part of the One Government at the Border programme, will provide a single service for import and export permissions across multiple departments. The service is currently focussed on the licensing of controlled (military and dualÂ­-use) goods, subject to the Export Control Act 2002.",
  "theme": "Business and self-employed",
  "organisation": "Department for Business and Trade",
  "phase": "Alpha",
  "timeline": {
    "items": [
      {
        "label": "Passed alpha assessment",
        "date": "2017-06-28",
        "links": [
          {
            "href": "https://www.gov.uk/service-standard-reports/licensing-for-international-trade-alpha-assessment",
            "text": "Service assessment report",
            "visuallyHiddenText": " for alpha assessment"
          }
        ]
      },
      {
        "label": "Did not pass alpha assessment",
        "date": "2017-05-27"
      }
    ]
  }
}
