{
  "name": "Replace MOT certificate",
  "description": "You can get a replacement MOT certificate online if you’ve lost or damaged the original.",
  "theme": "Driving and transport",
  "organisation": "Driver and Vehicle Standards Agency",
  "phase": "Beta",
  "liveService": "https://www.check-mot.service.gov.uk/?skipResults=true",
  "startPage": "https://www.gov.uk/replacing-lost-damaged-mot-certificate",
  "synonyms": [
    "Replace a lost or damaged MOT certificate"
  ]
}
